{
  "skill": "quiz",
  "skillSha256": "4e129e00855726f32a079753d894e7fb8875c081bbdc077e8560c6cf22d96d94",
  "suiteSha256": "3317adc779eb2797b94728a22cb2ffb3632f732f42e41ba227524632f71bfcf1",
  "runId": "20261016T203321Z",
  "generatedAt": "2026-10-16T20:49:49Z",
  "config": {
    "prompts": [
      "P01",
      "P02"
    ],
    "runs": 4,
    "wave": 4,
    "maxTurns": 12,
    "crossPerPrompt": 2,
    "agents": {
      "preset": "minimal",
      "run": {
        "model": "session",
        "effort": "session"
      },
      "grade": {
        "model": "sonnet",
        "effort": "session",
        "batch": "prompt"
      },
      "compare": {
        "model": "sonnet",
        "effort": "session",
        "batch": "merged"
      },
      "cross": {
        "model": "sonnet",
        "effort": "session",
        "batch": "all"
      }
    },
    "agentEstimate": 11,
    "sessionModel": "claude-opus-5-5"
  },
  "scores": {
    "quality": 91,
    "stability": 66.5,
    "overall": 77.8,
    "grade": "C",
    "confidence": "normal",
    "usableRuns": 8,
    "totalRuns": 8
  },
  "settle": {
    "settled": false,
    "settledAt": null,
    "delta": 2,
    "patience": 2,
    "stopWhenSettled": false,
    "wavesRun": 1
  },
  "trajectory": [
    {
      "wave": 1,
      "runsPerPrompt": 4,
      "usable": 8,
      "quality": 91,
      "stability": 63.5,
      "overall": 76,
      "grade": "C",
      "moved": null
    }
  ],
  "qualitySpread": {
    "min": 76,
    "median": 96,
    "max": 96
  },
  "items": [
    {
      "id": "R1",
      "kind": "structure",
      "weight": 2,
      "criterion": "Every question uses the fallback layout: a bold `**Question N of T · Label**` heading, the question, 2-4 options as a bulleted `**X · label**: sentence` list, and one `Reply …` hint line, with no code block or box drawing.",
      "passRate": 100,
      "stabilityWithin": 90,
      "classesWithin": {
        "P01": "equivalent",
        "P02": "equivalent"
      },
      "agreementWithin": 100,
      "stabilityCross": 100,
      "classCross": "identical"
    },
    {
      "id": "R2",
      "kind": "structure",
      "weight": 2,
      "criterion": "Each option has one sentence saying what it does and why it fits this request, ending on its cost or trade-off.",
      "passRate": 87.5,
      "stabilityWithin": 75,
      "classesWithin": {
        "P01": "minor_drift",
        "P02": "equivalent"
      },
      "agreementWithin": 75,
      "stabilityCross": 90,
      "classCross": "equivalent"
    },
    {
      "id": "R3",
      "kind": "structure",
      "weight": 2,
      "criterion": "The rhythm holds: each answer gets a one-line echo in one of the exact forms, at the top of the message that carries the next question.",
      "passRate": 100,
      "stabilityWithin": 75,
      "classesWithin": {
        "P01": "equivalent",
        "P02": "minor_drift"
      },
      "agreementWithin": 87.5,
      "stabilityCross": 60,
      "classCross": "minor_drift"
    },
    {
      "id": "R4",
      "kind": "structure",
      "weight": 2,
      "criterion": "After the last answer the skill shows a bulleted list with one echo line per question and asks for confirmation in one sentence; once confirmed, it says what it will do in one short paragraph before doing the work.",
      "passRate": 50,
      "stabilityWithin": 75,
      "classesWithin": {
        "P01": "equivalent",
        "P02": "minor_drift"
      },
      "agreementWithin": 87.5,
      "stabilityCross": 90,
      "classCross": "equivalent"
    },
    {
      "id": "R5",
      "kind": "behavior",
      "weight": 2,
      "criterion": "No assistant message contains more than one question.",
      "passRate": 100,
      "stabilityWithin": 95,
      "classesWithin": {
        "P01": "identical",
        "P02": "equivalent"
      },
      "agreementWithin": 100,
      "stabilityCross": null,
      "classCross": null
    },
    {
      "id": "R6",
      "kind": "behavior",
      "weight": 2,
      "criterion": "A question marks at most one option `(recommended)`, lists it first, and only when something the user said points to it, which its sentence names; with nothing to go on, no option is marked.",
      "passRate": 87.5,
      "stabilityWithin": 25,
      "classesWithin": {
        "P01": "major_drift",
        "P02": "major_drift"
      },
      "agreementWithin": 50,
      "stabilityCross": null,
      "classCross": null
    },
    {
      "id": "R7",
      "kind": "behavior",
      "weight": 1,
      "criterion": "The quiz commits to its question list up front: the total T stays the same from the first question to the last and matches the questions asked, and it is no more than about seven.",
      "passRate": 100,
      "stabilityWithin": 60,
      "classesWithin": {
        "P01": "minor_drift",
        "P02": "minor_drift"
      },
      "agreementWithin": 50,
      "stabilityCross": null,
      "classCross": null
    },
    {
      "id": "R8",
      "kind": "behavior",
      "weight": 2,
      "criterion": "Each echo records what the user actually replied, in the matching exact form: the choice, any note, `(you decided: recommended)` or `(you decided: first option)` for a deferral, `(from: \"…\")` for words matched to an option.",
      "passRate": 100,
      "stabilityWithin": 90,
      "classesWithin": {
        "P01": "equivalent",
        "P02": "equivalent"
      },
      "agreementWithin": 100,
      "stabilityCross": null,
      "classCross": null
    },
    {
      "id": "R9",
      "kind": "behavior",
      "weight": 1,
      "criterion": "No question, echo or resolved list is wrapped in a code block or drawn with box-drawing characters, and no emojis appear outside sample content.",
      "passRate": 100,
      "stabilityWithin": 95,
      "classesWithin": {
        "P01": "identical",
        "P02": "equivalent"
      },
      "agreementWithin": 100,
      "stabilityCross": null,
      "classCross": null
    },
    {
      "id": "R10",
      "kind": "outcome",
      "weight": 3,
      "criterion": "The questions asked are the ones whose answers would materially change the work for this request, most load-bearing first, and none re-asks something the prompt already settled.",
      "passRate": 87.5,
      "stabilityWithin": 42.5,
      "classesWithin": {
        "P01": "minor_drift",
        "P02": "major_drift"
      },
      "agreementWithin": 37.5,
      "stabilityCross": null,
      "classCross": null
    },
    {
      "id": "R11",
      "kind": "outcome",
      "weight": 3,
      "criterion": "Each question's options are realistic, distinct choices for this request, and any recommendation fits what the user said.",
      "passRate": 87.5,
      "stabilityWithin": 42.5,
      "classesWithin": {
        "P01": "minor_drift",
        "P02": "major_drift"
      },
      "agreementWithin": 37.5,
      "stabilityCross": null,
      "classCross": null
    },
    {
      "id": "R12",
      "kind": "outcome",
      "weight": 3,
      "criterion": "The paragraph before the work and the work itself reflect every resolved answer and note, so the user gets what they chose.",
      "passRate": 100,
      "stabilityWithin": 42.5,
      "classesWithin": {
        "P01": "minor_drift",
        "P02": "major_drift"
      },
      "agreementWithin": 50,
      "stabilityCross": null,
      "classCross": null
    }
  ],
  "prompts": [
    {
      "id": "P01",
      "usableRuns": 4,
      "quality": 86,
      "stability": 71.6
    },
    {
      "id": "P02",
      "usableRuns": 4,
      "quality": 96,
      "stability": 55.4
    }
  ],
  "runs": [
    {
      "label": "P01#1",
      "prompt": "P01",
      "repeat": 1,
      "capture": "evals/quiz/runs/20261016T203321Z/outputs/P01-r01.md",
      "status": "completed",
      "note": "",
      "quality": 76,
      "verdicts": [
        {
          "id": "R1",
          "verdict": "met",
          "evidence": "**Question 1 of 4 · Tone**"
        },
        {
          "id": "R2",
          "verdict": "partial",
          "evidence": "**C · Membership perks**: what the membership includes, like guest passes and shop discounts; it can read like a sales pitch."
        },
        {
          "id": "R3",
          "verdict": "met",
          "evidence": "✓ 2/4 Length → Short and scannable (note: mention the free intro belay class)"
        },
        {
          "id": "R4",
          "verdict": "partial",
          "evidence": "Going with these. Say `wait` if anything's wrong, otherwise I'll start."
        },
        {
          "id": "R5",
          "verdict": "met",
          "evidence": "**Question 2 of 4 · Length**"
        },
        {
          "id": "R6",
          "verdict": "partial",
          "evidence": "**A · Stoked (recommended)**: high energy, the way climbers talk to each other, since this is a climbing gym"
        },
        {
          "id": "R7",
          "verdict": "met",
          "evidence": "**Question 4 of 4 · Next step**"
        },
        {
          "id": "R8",
          "verdict": "met",
          "evidence": "✓ 2/4 Length → Short and scannable (note: mention the free intro belay class)"
        },
        {
          "id": "R9",
          "verdict": "met",
          "evidence": "- ✓ 1/4 Tone → Warm"
        },
        {
          "id": "R10",
          "verdict": "partial",
          "evidence": "**Question 1 of 4 · Tone**"
        },
        {
          "id": "R11",
          "verdict": "partial",
          "evidence": "**A · Stoked (recommended)**: high energy, the way climbers talk to each other, since this is a climbing gym"
        },
        {
          "id": "R12",
          "verdict": "met",
          "evidence": "So I'll write a short, warm welcome email that leads with the first-visit steps and asks new members to book the free intro belay class."
        }
      ],
      "excluded": null
    },
    {
      "label": "P01#2",
      "prompt": "P01",
      "repeat": 2,